{
  "$schema": "https://json-schema.org/draft/2020-12/schema",
  "$id": "https://mksoft-ltd.github.io/sides/schema/digest.schema.json",
  "title": "Sides daily digest",
  "description": "Contract between the Python pipeline and the Flutter app. Phase 1 defines outlets, articles and the collect-phase output; phase 2 adds stories (ranked, with coverage/blindspot) and meta; phase 3 adds the per-story analysis arrays (every item cites article ids of that story; the pipeline's citation validator drops anything unsourced).",
  "type": "object",
  "properties": {
    "schema_version": {
      "type": "integer",
      "const": 1
    },
    "generated_at": {
      "type": "string",
      "format": "date-time"
    },
    "date": {
      "type": "string",
      "format": "date"
    },
    "meta": {
      "$ref": "#/$defs/meta"
    },
    "outlets": {
      "type": "array",
      "items": {
        "$ref": "#/$defs/outlet"
      }
    },
    "stories": {
      "type": "array",
      "items": {
        "$ref": "#/$defs/story"
      },
      "maxItems": 10
    }
  },
  "required": [
    "schema_version",
    "generated_at",
    "date",
    "meta",
    "outlets",
    "stories"
  ],
  "$defs": {
    "lean": {
      "type": [
        "string",
        "null"
      ],
      "enum": [
        "left",
        "centre",
        "right",
        null
      ]
    },
    "bloc": {
      "type": "string",
      "enum": [
        "west",
        "east"
      ]
    },
    "region": {
      "type": "string",
      "enum": [
        "uk",
        "us",
        "europe",
        "middle_east",
        "asia",
        "africa",
        "oceania",
        "americas"
      ]
    },
    "ownership": {
      "type": "string",
      "enum": [
        "independent",
        "public-service",
        "state-funded",
        "state-controlled"
      ]
    },
    "outlet": {
      "type": "object",
      "description": "An outlet as shipped in the digest (feed URL and operational fields are not published).",
      "properties": {
        "id": {
          "type": "string",
          "pattern": "^[a-z][a-z0-9_]{1,31}$"
        },
        "name": {
          "type": "string",
          "minLength": 1
        },
        "lean": {
          "$ref": "#/$defs/lean"
        },
        "region": {
          "$ref": "#/$defs/region"
        },
        "bloc": {
          "$ref": "#/$defs/bloc"
        },
        "ownership": {
          "$ref": "#/$defs/ownership"
        },
        "country": {
          "type": "string",
          "minLength": 2
        },
        "home_url": {
          "type": "string",
          "format": "uri",
          "pattern": "^https?://"
        },
        "rating_basis": {
          "type": "string",
          "minLength": 1
        }
      },
      "required": [
        "id",
        "name",
        "lean",
        "region",
        "bloc",
        "ownership",
        "country",
        "home_url",
        "rating_basis"
      ],
      "additionalProperties": false
    },
    "article": {
      "type": "object",
      "description": "Headline plus a snippet of at most 200 characters. Full article text is never published.",
      "properties": {
        "id": {
          "type": "string",
          "pattern": "^[0-9a-f]{12}$"
        },
        "outlet_id": {
          "type": "string"
        },
        "headline": {
          "type": "string",
          "minLength": 1
        },
        "snippet": {
          "type": "string",
          "maxLength": 200
        },
        "url": {
          "type": "string",
          "format": "uri",
          "pattern": "^https?://"
        },
        "published_at": {
          "type": "string",
          "format": "date-time"
        },
        "published_at_estimated": {
          "type": "boolean",
          "default": false
        }
      },
      "required": [
        "id",
        "outlet_id",
        "headline",
        "snippet",
        "url",
        "published_at"
      ],
      "additionalProperties": false
    },
    "feed_error": {
      "type": "object",
      "properties": {
        "outlet_id": {
          "type": "string"
        },
        "error": {
          "type": "string"
        }
      },
      "required": [
        "outlet_id",
        "error"
      ],
      "additionalProperties": false
    },
    "collect_output": {
      "type": "object",
      "description": "pipeline/out/articles.json — the phase-1 artifact handed to phase 2 (grouping).",
      "properties": {
        "collected_at": {
          "type": "string",
          "format": "date-time"
        },
        "outlets": {
          "type": "array",
          "items": {
            "$ref": "#/$defs/outlet"
          }
        },
        "articles": {
          "type": "array",
          "items": {
            "$ref": "#/$defs/article"
          }
        },
        "feed_errors": {
          "type": "array",
          "items": {
            "$ref": "#/$defs/feed_error"
          }
        },
        "per_outlet_counts": {
          "type": "object",
          "additionalProperties": {
            "type": "integer",
            "minimum": 0
          }
        },
        "item_drops": {
          "description": "Feed items dropped at collect for a security reason (link_off_domain, instruction_text).",
          "type": "array",
          "items": {
            "type": "object",
            "properties": {
              "outlet_id": {"type": "string"},
              "reason": {"type": "string"},
              "count": {"type": "integer", "minimum": 1}
            },
            "required": ["outlet_id", "reason", "count"],
            "additionalProperties": false
          }
        }
      },
      "required": [
        "collected_at",
        "outlets",
        "articles",
        "feed_errors",
        "per_outlet_counts"
      ],
      "additionalProperties": false
    },
    "meta": {
      "type": "object",
      "description": "Run metadata; cost_usd is the whole run's LLM spend (grouping + analysis) from config/pricing.yaml; validation totals the citation validator across stories.",
      "properties": {
        "model": {
          "type": "string",
          "minLength": 1
        },
        "cost_usd": {
          "type": "number",
          "minimum": 0
        },
        "outlets_polled": {
          "type": "integer",
          "minimum": 0
        },
        "articles_collected": {
          "type": "integer",
          "minimum": 0
        },
        "warnings": {
          "type": "array",
          "items": {
            "type": "string"
          }
        },
        "validation": {
          "$ref": "#/$defs/validation"
        }
      },
      "required": [
        "model",
        "cost_usd",
        "outlets_polled",
        "articles_collected",
        "warnings",
        "validation"
      ],
      "additionalProperties": false
    },
    "coverage": {
      "type": "object",
      "description": "Distinct outlets covering the story, computed in code from outlet tags. lean=null outlets count in bloc only.",
      "properties": {
        "lean": {
          "type": "object",
          "properties": {
            "left": {
              "type": "integer",
              "minimum": 0
            },
            "centre": {
              "type": "integer",
              "minimum": 0
            },
            "right": {
              "type": "integer",
              "minimum": 0
            }
          },
          "required": [
            "left",
            "centre",
            "right"
          ],
          "additionalProperties": false
        },
        "bloc": {
          "type": "object",
          "properties": {
            "west": {
              "type": "integer",
              "minimum": 0
            },
            "east": {
              "type": "integer",
              "minimum": 0
            }
          },
          "required": [
            "west",
            "east"
          ],
          "additionalProperties": false
        }
      },
      "required": [
        "lean",
        "bloc"
      ],
      "additionalProperties": false
    },
    "blindspot": {
      "type": "object",
      "description": "The only lean / bloc covering the story when every other has zero outlets; null otherwise.",
      "properties": {
        "lean": {
          "$ref": "#/$defs/lean"
        },
        "bloc": {
          "type": [
            "string",
            "null"
          ],
          "enum": [
            "west",
            "east",
            null
          ]
        }
      },
      "required": [
        "lean",
        "bloc"
      ],
      "additionalProperties": false
    },
    "story": {
      "type": "object",
      "description": "A top story: ≥3 distinct outlets, ranked in code. The analysis arrays are required but may be empty (a story whose analysis call failed ships with empty arrays and a meta.warnings entry).",
      "properties": {
        "id": {
          "type": "string",
          "pattern": "^[0-9a-f]{12}$",
          "description": "sha1 prefix of the sorted article ids"
        },
        "title": {
          "type": "string",
          "minLength": 1,
          "maxLength": 90
        },
        "rank": {
          "type": "integer",
          "minimum": 1
        },
        "outlet_count": {
          "type": "integer",
          "minimum": 1,
          "description": "distinct outlets"
        },
        "coverage": {
          "$ref": "#/$defs/coverage"
        },
        "blindspot": {
          "$ref": "#/$defs/blindspot"
        },
        "articles": {
          "type": "array",
          "minItems": 1,
          "items": {
            "$ref": "#/$defs/article"
          }
        },
        "agreed_facts": {
          "type": "array",
          "items": {
            "$ref": "#/$defs/sourced"
          }
        },
        "framing": {
          "type": "array",
          "items": {
            "$ref": "#/$defs/lean_framing"
          }
        },
        "omissions": {
          "type": "array",
          "items": {
            "$ref": "#/$defs/omission"
          }
        },
        "contested_claims": {
          "type": "array",
          "items": {
            "$ref": "#/$defs/contested_claim"
          }
        },
        "opinion": {
          "type": "array",
          "items": {
            "$ref": "#/$defs/sourced"
          }
        },
        "framing_by_bloc": {
          "type": "array",
          "items": {
            "$ref": "#/$defs/bloc_framing"
          }
        },
        "east_west_contradictions": {
          "type": "array",
          "items": {
            "$ref": "#/$defs/contradiction"
          }
        },
        "validation": {
          "$ref": "#/$defs/validation"
        }
      },
      "required": [
        "id",
        "title",
        "rank",
        "outlet_count",
        "coverage",
        "blindspot",
        "articles",
        "agreed_facts",
        "framing",
        "omissions",
        "contested_claims",
        "opinion",
        "framing_by_bloc",
        "east_west_contradictions",
        "validation"
      ],
      "additionalProperties": false
    },
    "article_ids": {
      "type": "array",
      "minItems": 1,
      "items": {
        "type": "string",
        "pattern": "^[0-9a-f]{12}$"
      },
      "description": "Article ids from the same story; never empty."
    },
    "sourced": {
      "type": "object",
      "description": "One analytical point and the article ids it rests on.",
      "properties": {
        "text": {
          "type": "string",
          "minLength": 1,
          "maxLength": 200
        },
        "sources": {
          "$ref": "#/$defs/article_ids"
        }
      },
      "required": [
        "text",
        "sources"
      ],
      "additionalProperties": false
    },
    "headline_quote": {
      "type": "object",
      "description": "Verbatim substring of the cited article's headline or snippet; field says which (set by the validator, headline preferred when both match).",
      "properties": {
        "article_id": {
          "type": "string",
          "pattern": "^[0-9a-f]{12}$"
        },
        "quote": {
          "type": "string",
          "minLength": 1
        },
        "field": {
          "type": "string",
          "enum": [
            "headline",
            "snippet"
          ]
        }
      },
      "required": [
        "article_id",
        "quote",
        "field"
      ],
      "additionalProperties": false
    },
    "lean_framing": {
      "type": "object",
      "description": "How outlets of one lean frame the story; only leans with ≥1 article appear.",
      "properties": {
        "lean": {
          "type": "string",
          "enum": [
            "left",
            "centre",
            "right"
          ]
        },
        "headline_quotes": {
          "type": "array",
          "items": {
            "$ref": "#/$defs/headline_quote"
          }
        },
        "emphasis": {
          "type": "array",
          "items": {
            "$ref": "#/$defs/sourced"
          }
        }
      },
      "required": [
        "lean",
        "headline_quotes",
        "emphasis"
      ],
      "additionalProperties": false
    },
    "bloc_framing": {
      "type": "object",
      "description": "How outlets of one bloc (West/East) frame the story; only blocs with ≥1 article appear.",
      "properties": {
        "bloc": {
          "$ref": "#/$defs/bloc"
        },
        "headline_quotes": {
          "type": "array",
          "items": {
            "$ref": "#/$defs/headline_quote"
          }
        },
        "emphasis": {
          "type": "array",
          "items": {
            "$ref": "#/$defs/sourced"
          }
        }
      },
      "required": [
        "bloc",
        "headline_quotes",
        "emphasis"
      ],
      "additionalProperties": false
    },
    "omission": {
      "type": "object",
      "description": "A point that lean X's coverage does not mention, sourced to the articles (of other leans) that do carry it.",
      "properties": {
        "lean": {
          "type": "string",
          "enum": [
            "left",
            "centre",
            "right"
          ]
        },
        "text": {
          "type": "string",
          "minLength": 1,
          "maxLength": 200
        },
        "sources": {
          "$ref": "#/$defs/article_ids"
        }
      },
      "required": [
        "lean",
        "text",
        "sources"
      ],
      "additionalProperties": false
    },
    "contested_claim": {
      "type": "object",
      "description": "A claim some articles assert and others dispute; the two sides come from different outlets.",
      "properties": {
        "claim": {
          "type": "string",
          "minLength": 1,
          "maxLength": 200
        },
        "asserted_by": {
          "$ref": "#/$defs/article_ids"
        },
        "disputed_by": {
          "$ref": "#/$defs/article_ids"
        }
      },
      "required": [
        "claim",
        "asserted_by",
        "disputed_by"
      ],
      "additionalProperties": false
    },
    "contradiction": {
      "type": "object",
      "description": "West and East coverage stating incompatible things about one topic; west.sources are West-bloc articles, east.sources East-bloc.",
      "properties": {
        "topic": {
          "type": "string",
          "minLength": 1,
          "maxLength": 200
        },
        "west": {
          "$ref": "#/$defs/sourced"
        },
        "east": {
          "$ref": "#/$defs/sourced"
        }
      },
      "required": [
        "topic",
        "west",
        "east"
      ],
      "additionalProperties": false
    },
    "validation": {
      "type": "object",
      "description": "Citation-validator counts: items kept, and items dropped per reason.",
      "properties": {
        "kept": {
          "type": "integer",
          "minimum": 0
        },
        "dropped_by_reason": {
          "type": "object",
          "additionalProperties": {
            "type": "integer",
            "minimum": 0
          }
        }
      },
      "required": [
        "kept",
        "dropped_by_reason"
      ],
      "additionalProperties": false
    }
  },
  "additionalProperties": false
}
