{
  "schema_version": 1,
  "generated_at": "2026-10-14T23:43:24.898053Z",
  "date": "2026-10-14",
  "meta": {
    "model": "claude-opus-5-5",
    "cost_usd": 1.343432,
    "outlets_polled": 29,
    "articles_collected": 667,
    "warnings": [
      "2 feed(s) failed during collect"
    ],
    "validation": {
      "kept": 324,
      "dropped_by_reason": {}
    }
  },
  "outlets": [
    {
      "id": "guardian",
      "name": "The Guardian",
      "lean": "left",
      "region": "uk",
      "bloc": "west",
      "ownership": "independent",
      "country": "United Kingdom",
      "home_url": "https://www.theguardian.com/",
      "rating_basis": "AllSides media bias rating (Lean Left), checked Oct 2026"
    },
    {
      "id": "independent",
      "name": "The Independent",
      "lean": "left",
      "region": "uk",
      "bloc": "west",
      "ownership": "independent",
      "country": "United Kingdom",
      "home_url": "https://www.independent.co.uk/",
      "rating_basis": "AllSides media bias rating (Lean Left), checked Oct 2026"
    },
    {
      "id": "mirror",
      "name": "Daily Mirror",
      "lean": "left",
      "region": "uk",
      "bloc": "west",
      "ownership": "independent",
      "country": "United Kingdom",
      "home_url": "https://www.mirror.co.uk/",
      "rating_basis": "Ad Fontes Media bias rating (Skews Left), checked Oct 2026"
    },
    {
      "id": "bbc",
      "name": "BBC News",
      "lean": "centre",
      "region": "uk",
      "bloc": "west",
      "ownership": "public-service",
      "country": "United Kingdom",
      "home_url": "https://www.bbc.co.uk/news",
      "rating_basis": "AllSides media bias rating (Center), checked Oct 2026"
    },
    {
      "id": "sky",
      "name": "Sky News",
      "lean": "centre",
      "region": "uk",
      "bloc": "west",
      "ownership": "independent",
      "country": "United Kingdom",
      "home_url": "https://news.sky.com/",
      "rating_basis": "Ad Fontes Media bias rating (Middle), checked Oct 2026"
    },
    {
      "id": "telegraph",
      "name": "The Telegraph",
      "lean": "right",
      "region": "uk",
      "bloc": "west",
      "ownership": "independent",
      "country": "United Kingdom",
      "home_url": "https://www.telegraph.co.uk/",
      "rating_basis": "AllSides media bias rating (Lean Right), checked Oct 2026"
    },
    {
      "id": "dailymail",
      "name": "Daily Mail",
      "lean": "right",
      "region": "uk",
      "bloc": "west",
      "ownership": "independent",
      "country": "United Kingdom",
      "home_url": "https://www.dailymail.co.uk/",
      "rating_basis": "AllSides media bias rating (Right), checked Oct 2026"
    },
    {
      "id": "thesun",
      "name": "The Sun",
      "lean": "right",
      "region": "uk",
      "bloc": "west",
      "ownership": "independent",
      "country": "United Kingdom",
      "home_url": "https://www.thesun.co.uk/",
      "rating_basis": "AllSides media bias rating (Right), checked Oct 2026"
    },
    {
      "id": "nyt",
      "name": "The New York Times",
      "lean": "left",
      "region": "us",
      "bloc": "west",
      "ownership": "independent",
      "country": "United States",
      "home_url": "https://www.nytimes.com/",
      "rating_basis": "AllSides media bias rating (Lean Left), checked Oct 2026"
    },
    {
      "id": "nbc",
      "name": "NBC News",
      "lean": "left",
      "region": "us",
      "bloc": "west",
      "ownership": "independent",
      "country": "United States",
      "home_url": "https://www.nbcnews.com/",
      "rating_basis": "AllSides media bias rating (Lean Left), checked Oct 2026"
    },
    {
      "id": "huffpost",
      "name": "HuffPost",
      "lean": "left",
      "region": "us",
      "bloc": "west",
      "ownership": "independent",
      "country": "United States",
      "home_url": "https://www.huffpost.com/",
      "rating_basis": "AllSides media bias rating (Left), checked Oct 2026"
    },
    {
      "id": "npr",
      "name": "NPR",
      "lean": "centre",
      "region": "us",
      "bloc": "west",
      "ownership": "public-service",
      "country": "United States",
      "home_url": "https://www.npr.org/",
      "rating_basis": "Ad Fontes Media bias rating (Middle / Skews Left), checked Oct 2026"
    },
    {
      "id": "axios",
      "name": "Axios",
      "lean": "centre",
      "region": "us",
      "bloc": "west",
      "ownership": "independent",
      "country": "United States",
      "home_url": "https://www.axios.com/",
      "rating_basis": "AllSides media bias rating (Center), checked Oct 2026"
    },
    {
      "id": "fox",
      "name": "Fox News",
      "lean": "right",
      "region": "us",
      "bloc": "west",
      "ownership": "independent",
      "country": "United States",
      "home_url": "https://www.foxnews.com/",
      "rating_basis": "AllSides media bias rating (Right), checked Oct 2026"
    },
    {
      "id": "nypost",
      "name": "New York Post",
      "lean": "right",
      "region": "us",
      "bloc": "west",
      "ownership": "independent",
      "country": "United States",
      "home_url": "https://nypost.com/",
      "rating_basis": "AllSides media bias rating (Lean Right), checked Oct 2026"
    },
    {
      "id": "examiner",
      "name": "Washington Examiner",
      "lean": "right",
      "region": "us",
      "bloc": "west",
      "ownership": "independent",
      "country": "United States",
      "home_url": "https://www.washingtonexaminer.com/",
      "rating_basis": "AllSides media bias rating (Lean Right), checked Oct 2026"
    },
    {
      "id": "france24",
      "name": "France 24",
      "lean": "centre",
      "region": "europe",
      "bloc": "west",
      "ownership": "public-service",
      "country": "France",
      "home_url": "https://www.france24.com/en/",
      "rating_basis": "Ad Fontes Media bias rating (Middle), checked Oct 2026"
    },
    {
      "id": "dw",
      "name": "DW (Deutsche Welle)",
      "lean": "centre",
      "region": "europe",
      "bloc": "west",
      "ownership": "public-service",
      "country": "Germany",
      "home_url": "https://www.dw.com/en/",
      "rating_basis": "AllSides media bias rating (Center), checked Oct 2026"
    },
    {
      "id": "aljazeera",
      "name": "Al Jazeera English",
      "lean": null,
      "region": "middle_east",
      "bloc": "east",
      "ownership": "state-funded",
      "country": "Qatar",
      "home_url": "https://www.aljazeera.com/",
      "rating_basis": "Funded by the State of Qatar; no left/right tag applied"
    },
    {
      "id": "thenational",
      "name": "The National (UAE)",
      "lean": null,
      "region": "middle_east",
      "bloc": "east",
      "ownership": "independent",
      "country": "United Arab Emirates",
      "home_url": "https://www.thenationalnews.com/",
      "rating_basis": "Owned by International Media Investments (Abu Dhabi); no left/right tag applied"
    },
    {
      "id": "timesofisrael",
      "name": "The Times of Israel",
      "lean": null,
      "region": "middle_east",
      "bloc": "east",
      "ownership": "independent",
      "country": "Israel",
      "home_url": "https://www.timesofisrael.com/",
      "rating_basis": "Privately owned; no left/right tag applied"
    },
    {
      "id": "cgtn",
      "name": "CGTN",
      "lean": null,
      "region": "asia",
      "bloc": "east",
      "ownership": "state-controlled",
      "country": "China",
      "home_url": "https://www.cgtn.com/",
      "rating_basis": "China Global Television Network, part of state broadcaster China Media Group"
    },
    {
      "id": "ecns",
      "name": "ECNS (China News Service)",
      "lean": null,
      "region": "asia",
      "bloc": "east",
      "ownership": "state-controlled",
      "country": "China",
      "home_url": "https://www.ecns.cn/",
      "rating_basis": "English service of China News Service, a state news agency"
    },
    {
      "id": "scmp",
      "name": "South China Morning Post",
      "lean": null,
      "region": "asia",
      "bloc": "east",
      "ownership": "independent",
      "country": "Hong Kong",
      "home_url": "https://www.scmp.com/",
      "rating_basis": "Owned by Alibaba Group; no left/right tag applied"
    },
    {
      "id": "toi",
      "name": "The Times of India",
      "lean": null,
      "region": "asia",
      "bloc": "east",
      "ownership": "independent",
      "country": "India",
      "home_url": "https://timesofindia.indiatimes.com/",
      "rating_basis": "Privately owned (Bennett, Coleman & Co.); no left/right tag applied"
    },
    {
      "id": "thehindu",
      "name": "The Hindu",
      "lean": null,
      "region": "asia",
      "bloc": "east",
      "ownership": "independent",
      "country": "India",
      "home_url": "https://www.thehindu.com/",
      "rating_basis": "Privately owned (The Hindu Group); no left/right tag applied"
    },
    {
      "id": "moscowtimes",
      "name": "The Moscow Times",
      "lean": null,
      "region": "europe",
      "bloc": "east",
      "ownership": "independent",
      "country": "Russia",
      "home_url": "https://www.themoscowtimes.com/",
      "rating_basis": "Independent, Amsterdam-based since 2022; designated \"undesirable\" by Russia; no left/right tag applied"
    },
    {
      "id": "japantimes",
      "name": "The Japan Times",
      "lean": null,
      "region": "asia",
      "bloc": "east",
      "ownership": "independent",
      "country": "Japan",
      "home_url": "https://www.japantimes.co.jp/",
      "rating_basis": "Privately owned (News2u Holdings); no left/right tag applied"
    },
    {
      "id": "koreaherald",
      "name": "The Korea Herald",
      "lean": null,
      "region": "asia",
      "bloc": "east",
      "ownership": "independent",
      "country": "South Korea",
      "home_url": "https://www.koreaherald.com/",